{
  "answer": "Retry handling is defined in src/retry.py, lines 10-14.",
  "citations": [
    {
      "chunk_id": "88888888-8888-4888-8888-888888888888",
      "repository_id": "11111111-1111-4111-8111-111111111111",
      "generation_id": "44444444-4444-4444-8444-444444444444",
      "commit_sha": "0123456789abcdef0123456789abcdef01234567",
      "path": "src/retry.py",
      "start_line": 10,
      "end_line": 14
    }
  ],
  "evidence_status": "supported",
  "model": "mock",
  "estimated_cost_usd": "0.000000"
}
